{
  "$schema": "../schemas/hotel-public-release-readback.schema.json",
  "identity": {
    "informationUuidV5": "5dfb6e29-8be6-5ec4-b4b9-1d6a80992d39",
    "observationUuidV7": "01a05753-c598-7087-a3d8-a85e7f60a8f8",
    "observedAt": "2026-08-31T10:18:23.000Z"
  },
  "release": {
    "status": "COMMITTED_RELEASE",
    "sourceCommit": "bbb1b611dbaf9bb2172e59da3e63bbe71799bfeb",
    "branch": "main",
    "baseCommit": "adeaf3f549aa7379acacbc6960eae4c11bbc6ba2",
    "testRun": {
      "command": "npm test",
      "directory": "src/typescript",
      "passed": 194,
      "failed": 0,
      "skipped": 0,
      "testCount": 194,
      "countSource": "node-test-summary"
    },
    "artifacts": {
      "functionalClientSha256": "9bef79c7d09a953e19156c9d823f1d963b8102b63e651af50ac2cda94345f704",
      "fullClientSha256": "8206697ef5b0d344d513e0c31d006ca4d86a9c505d9854d18468899d2fe4e4e6",
      "fullSitesPackageSha256": "da8f7dcfb0292c4061f38983da87c0665f3dcff3bf5bcb892f7e3af12dbdc893"
    }
  },
  "deployment": {
    "provider": "Vercel",
    "teamId": "team_npJWoj9cpy54Q7B3fpGdBCCX",
    "projectId": "prj_sfErclBd1NgXtkeA5PVntIoj6Q3X",
    "projectName": "kyoto-booking-retry-proof",
    "deploymentId": "dpl_A39LNXnMRAA6RscBYJLkZBok1Y3B",
    "target": "production",
    "state": "READY",
    "sourceCommit": "bbb1b611dbaf9bb2172e59da3e63bbe71799bfeb",
    "publicUrl": "https://kyoto-booking-retry-proof.vercel.app/",
    "uniqueUrl": "https://kyoto-booking-retry-proof-npnpjh2p8-aniotajp-1978s-projects.vercel.app",
    "readyAt": "2026-08-31T10:11:53.251Z",
    "observedAt": "2026-08-31T10:18:23.000Z"
  },
  "anonymousReadback": {
    "url": "https://kyoto-booking-retry-proof.vercel.app/webmcp-evals.json",
    "statusCode": 200,
    "authentication": "ANONYMOUS",
    "observedAt": "2026-08-31T10:18:23.000Z",
    "contentSha256": "2851ce1bdc2aad55cf6f8f453e05b30e60e9ce52073c2e39d72a79c34da7c4fe",
    "localBuiltFileSha256": "2851ce1bdc2aad55cf6f8f453e05b30e60e9ce52073c2e39d72a79c34da7c4fe",
    "releaseEvidence": {
      "status": "PASS",
      "testCommand": "npm test",
      "testDirectory": "src/typescript",
      "testCount": 194,
      "countSource": "node-test-summary"
    }
  }
}
